question,answer
"Where can you use `inject()` within a component or service class?", "Directly in the class body (outside the constructor)."
"Why is using `inject()` in the class body recommended?", "It's more streamlined and declarative, aligning with modern Angular patterns."
"When should you use dynamic component injection?", "For UI features or components that can be loaded on-demand or conditionally at runtime."
"What function is used to dynamically create component instances?", "`createComponent()`"
"What is `ViewContainerRef` used for in dynamic component injection?", "It provides the insertion point in the DOM for dynamically created components."
"How do you dynamically create and insert a component?", "`createComponent(ComponentClass, { viewContainerRef: ..., injector: ... })`"
"What is the difference between lazy-loading modules and dynamic component injection?", "Lazy-loading modules is for feature-level code splitting (via the Router), while dynamic component injection is for loading individual components on-demand."
"What is the primary method for lazy loading in Angular applications?", "Lazy-loading feature modules via the Angular Router (using `loadChildren`)."
"How do you configure routes for lazy-loading modules?", "Use `loadChildren` in route configurations with `() => import(...)` syntax."
"How do you lazy-load standalone components directly in route configurations?", "Use `loadComponent` in route configurations with `() => import(...)` syntax."
"What types of modules or components are good candidates for lazy loading?", "Modules/components that are large, used less frequently, not essential for the critical path, or located below-the-fold."
"When should you use Factory Providers (`useFactory`)?", "When dependency creation requires complex logic, conditional instantiation, runtime configuration, or asynchronous operations."
"What are Injection Tokens used for?", "To provide interfaces or abstract types as dependencies, promoting decoupling and testability."
"How do you create an Injection Token?", "`new InjectionToken<InterfaceType>('TokenName')`"
"How do you provide a concrete implementation for an Injection Token?", "Use `useClass`, `useFactory`, `useValue`, or `useExisting` in the `providers` array."
"What are the two main provider scopes in Angular?", "`providedIn: 'root'` for application-wide singletons and component-level providers for component-scoped instances."
"When should you use `providedIn: 'root'`?", "For singleton services shared across the entire application."
"When should you use component-level providers?", "For services intended to be scoped to a specific component and its subtree."
"How does Dependency Injection support the Liskov Substitution Principle (LSP)?", "By allowing different concrete implementations of an interface (provided via an Injection Token) to be interchangeable without breaking consuming components."
"What does the Single Responsibility Principle (SRP) mean for Angular Services?", "Services should have a focused, well-defined responsibility and encapsulate a specific set of related functionalities."
"How does interface-based programming with Injection Tokens support the Interface Segregation Principle (ISP)?", "It encourages creating focused interfaces that represent a specific, cohesive set of functionalities, avoiding "fat interfaces"."
"What should you check to ensure type safety with `inject()`?", "Verify that the generic type parameter is consistently used with `inject()` when injecting tokens."
"What should you check regarding dynamic component injection?", "Verify that it's used appropriately for on-demand loading or modularity, and that `createComponent()` and `ViewContainerRef` are used correctly."
"What should you check regarding lazy loading?", "Verify that route-based lazy loading is configured for feature modules or standalone components to optimize initial load time."
"What should you check regarding Factory Providers?", "Verify that they are used when dependency creation requires complex logic."
"What should you check regarding Injection Tokens?", "Verify that they are used to provide interfaces as dependencies, promoting decoupling."
"What should you check regarding provider scope?", "Verify that provider scope (`providedIn: 'root'` or component-level) is appropriately chosen."
"What SOLID principles should the DI design adhere to?", "Liskov Substitution Principle (LSP) and Single Responsibility Principle (SRP)."
"How can you ensure performance-conscious DI?", "Utilize lazy loading, dynamic injection, and efficient provider strategies."