question,answer
"How should the subject line be capitalized and punctuated?", "Capitalize the first word of the subject line. Do not end the subject line with a period."
"When should you include an optional commit body?", "Include an optional commit body when the subject line alone is insufficient to fully explain the details reasoning or context."
"How should the commit body be formatted?", "Format the commit body using either bullet points OR a Mermaid diagram to structure information effectively."
"What is the maximum line length for the commit body?", "Wrap text in the body to a maximum of 72 characters per line."
"How should paragraphs be separated in the commit body?", "Separate different ideas or distinct explanations into separate paragraphs."
"When should you include a `BREAKING CHANGE:` section?", "Include a dedicated `BREAKING CHANGE:` section if the commit introduces changes that break backward compatibility."
"How should the breaking change section be formatted?", "Format with a `BREAKING CHANGE:` header followed by a blank line and then a clear and detailed explanation."
"What is the purpose of the commit message footer?", "Utilize the commit message footer to reference related issues bug tracker IDs or pull requests when applicable."
"What is an example of a well-structured, complete commit message?", "The provided guidelines include a complete example combining all parts. For simpler commits a subject line alone might be sufficient."
"What should you always do before finalizing a commit message?", "Always review and edit it to ensure clarity conciseness and completeness."
"How should you adapt the commit message guidelines to specific projects?", "Adapt the commit message guidelines slightly to fit your project's specific needs or team conventions if necessary. Document deviations."
"What is the objective of the General Code Generation Ruleset for AI Agents?", "To guide general code generation across any programming language or technology focusing on instilling architect-level thinking promoting high-quality software engineering principles and acting as a mentor."
"What kind of mindset should the AI agent embody?", "Function as more than just a code generator; embody the mindset of a seasoned Software Architect."
"What should be the primary guiding force in all code generation decisions?", "Let established Software Design Principles (SOLID DRY KISS YAGNI etc.) be the primary guiding force."
"What is the importance of simplicity in code generation?", "Champion simplicity in all generated code and architectural suggestions. Simple code is better code."
"What should be the focus of code generation and architectural guidance beyond immediate functionality?", "Center code generation and architectural guidance on long-term maintainability and the enduring value of the software."
"What should the AI agent do before generating any code?", "Prioritize thoroughly understanding and analyzing the user's underlying problem requirements and constraints. Understand the \"why\"."
"How should code generation and suggestions be framed?", "Frame code generation and suggestions within a broader architectural vision and context."
"What qualities should all generated code consistently embody?", "Ensure all generated code consistently embodies software engineering best practices for code quality efficiency security and maintainability."
"How should the AI agent approach its role in relation to the user?", "Frame your role as an AI programming mentor focused on empowering the user to grow as a software architect and developer."
"How should the AI agent handle user assumptions or decisions that deviate from best practices?", "Do not be afraid to respectfully challenge the user's assumptions or initial decisions if they deviate from best practices."
"What should the AI agent explain when presenting architectural options or coding choices?", "Always explicitly explain the trade-offs benefits and drawbacks associated with each option."
"How can the AI agent foster continuous improvement?", "Actively encourage user feedback on the quality and relevance of the guidance and generated code."
"How should the AI agent respond to user resistance to feedback?", "If the user demonstrates resistance to feedback maintain a patient supportive and understanding approach."
"How should the AI agent tailor its guidance to individual users?", "Adapt the level of detail complexity and explanation provided in your guidance to the user's skill level and learning style."
"How should the AI agent acknowledge and encourage user progress?", "Actively celebrate user progress and milestones throughout the code generation and mentorship process."
"What is the objective of the Code Review Generation Ruleset?", "To provide a concise ruleset for AI agents to perform expert-level code reviews emulating the thoroughness insight and constructive feedback of a seasoned code reviewer."
"What aspects of code should be assessed during a code review?", "Review code holistically. Functionality Performance Readability Security Architecture Testing Documentation Error Handling Scalability Best Practices"
"What qualities should characterize code review feedback?", "Provide feedback that is consistently constructive and actionable. Offer clear and specific guidance."
"What should accompany all code review feedback?", "Always provide clear justification and rationale for code review feedback. Explain *why* a change is recommended."
"What kind of tone should be maintained during the code review process?", "Maintain a positive and encouraging tone throughout the code review process."
"What is the first step in verifying code during a review?", "Verify that the code correctly implements the intended functionality and meets the specified requirements."
"What coding practices should be assessed to ensure code robustness?", "Assess the code for defensive coding practices and robust error handling."
"How should code review address algorithm efficiency and performance?", "Evaluate the efficiency of algorithms used in the code considering both time complexity and space complexity."
"What aspects of code readability and clarity should be assessed?", "Prioritize code readability and clarity. Clear names. Structure. Indentation. Organization. Comments. Style conventions."
"How should code review address modularity and reusability?", "Evaluate the modularity and reusability of the code. Broken down into modules. Reusability. Separation of concerns."
"How should code review enforce code style and conventions?", "Verify that the code consistently adheres to established code style guidelines and coding conventions."
"What should code review actively scan for regarding security?", "Actively scan for potential security vulnerabilities in the code especially for common security pitfalls."
"How should code review assess the code's relationship to the overall system architecture?", "Verify that the code adheres to the overall system architecture and established architectural principles."
"What aspects of testing should be evaluated during a code review?", "Evaluate test coverage and test quality. Comprehensive. Edge cases. Well-structured. Good practices."
"How should code review assess documentation and comments?", "Assess the quality and completeness of code documentation and comments. JSDoc. Clear comments. Architectural documentation."
"What aspects of error handling and resilience should be reviewed?", "Evaluate the code's error handling and resilience mechanisms. Graceful handling. Recovery. Informative messages. Logging."
"How can code review feedback be made more actionable and effective?", "Ensure all code review feedback is actionable. Provide specific concrete steps. Utilize code snippets and examples."
"How can code review feedback be made more persuasive and educational?", "Always provide clear justification and rationale. Explain *why*."
"What tone should be maintained in code review feedback (reinforcement)?", "Maintain a positive and encouraging tone in all code review comments."
"How should the code reviewer prioritize feedback?", "Prioritize highlighting and addressing the most critical issues and areas for improvement first."
"How can code review feedback be made more practical and illustrative?", "Use code snippets and examples to illustrate feedback."
"Create a code review verification checklist for AI Agents.","[ ] Holistic Code Assessment (Beyond Syntax): Does the code review assess code holistically considering functionality performance readability security architecture testing documentation etc. and not just syntax or basic correctness?\n[ ] Constructive and Actionable Feedback (Guidance Provided): Is feedback consistently constructive and actionable providing clear steps and guidance for improvement not just pointing out issues?\n[ ] Justification and Rationale Explained (\"Why\" Clearly Articulated): Is clear justification and rationale provided for all code review feedback explaining *why* changes are recommended and referencing relevant best practices or principles?\n[ ] Positive and Encouraging Tone Maintained (Growth Mindset Fostered): Is a consistently positive and encouraging tone maintained throughout the code review feedback to foster a growth mindset and encourage a collaborative learning environment?\n[ ] Functional Correctness Verified (Meets Requirements?): Does the code review verify the functional correctness of the code ensuring it meets specified requirements and intended behavior?\n[ ] Defensive Coding Practices Assessed (Robustness & Error Handling): Are defensive coding practices and robust error handling mechanisms actively assessed for code robustness and resilience?\n[ ] Algorithm Efficiency & Performance Considerations Evaluated (Time & Space): Is algorithm efficiency evaluated considering time and space complexity and identifying potential performance bottlenecks?\n[ ] Code Readability and Clarity Assessed (Easy to Understand): Is code readability and clarity assessed ensuring code is well-structured formatted and easy to understand by other developers?\n[ ] Modularity and Reusability Evaluated (Code Organization): Is modularity and reusability evaluated assessing code organization componentization and potential for code reuse?\n[ ] Adherence to Code Style & Conventions Verified (Project Consistency): Is adherence to established code style guidelines and coding conventions verified to ensure project-wide consistency?\n[ ] Security Vulnerability Detection (Common Pitfalls Scanned For): Does the code review actively scan for common security vulnerabilities (injection attacks authentication flaws data leaks etc.)?\n[ ] Architectural Alignment Verified (Design Principle Adherence): Is architectural alignment verified ensuring code adheres to overall system architecture and established architectural principles?\n[ ] Test Coverage and Test Quality Assessed (Thorough Testing): Is test coverage and test quality assessed verifying adequate and high-quality testing including edge cases and error scenarios?\n[ ] Documentation and Code Comments Evaluated (Clarity & Completeness): Is documentation and code commenting evaluated for quality and completeness ensuring code is well-documented for future maintainability?\n[ ] Error Handling & Resilience Mechanisms Reviewed (Graceful Failure): Are error handling and resilience mechanisms reviewed to ensure graceful failure handling and application stability?\n[ ] Actionable Feedback Provided (Clear Steps for Improvement - Rule Reinforcement): Is feedback consistently actionable providing clear and concrete steps for code authors to implement improvements?\n[ ] Justified Feedback (Rationale Explained - Rule Reinforcement): Is all feedback clearly justified and rationalized explaining *why* changes are recommended and referencing relevant principles?\n[ ] Positive and Encouraging Tone (Growth Mindset - Rule Reinforcement): Is a positive and encouraging tone maintained throughout the code review fostering a growth mindset and collaborative learning?\n[ ] Prioritized Critical Issues (High-Impact Feedback Focus): Does the code review prioritize highlighting and addressing the most critical issues and high-impact areas first?\n[ ] Code Snippets/Examples Used to Illustrate Feedback (Practical Guidance): Are code snippets and examples used to illustrate feedback making suggestions more tangible and actionable?"
"What is the primary objective of the Minimalist Purposeful and Technically Rich Code Commenting Ruleset?", "To provide a concise ruleset for AI agents to generate high-quality minimalist purposeful and technically rich code comments in any programming language."
"What should be prioritized over extensive commenting?", "Prioritize generating self-explanatory code that minimizes the need for comments."
"What should comments primarily explain?", "Focus all generated comments on explaining the \"why\" behind the code and avoid redundant comments that simply restate the \"what\"."
"How should comment noise be handled?", "Minimize comment noise ruthlessly. Generate code with the fewest comments possible while still ensuring sufficient documentation."
"Where should the majority of commenting efforts be focused?", "Focus the vast majority of commenting efforts on thoroughly documenting Public Methods Public Functions Exported Classes Interfaces and Public APIs."
"When should comments be used to clarify internal code details?", "Strategically use comments to clarify complex logic algorithms or non-obvious code implementations."
"What should comments clarify for class members (properties and methods)?", "Provide concise but informative comments to document the purpose and role of key Class Members."
"What qualities should effective code comments possess?", "Generate comments that are genuinely technical and descriptive providing specific and informative details."
"How should comments explain the intent and rationale behind code?", "Generate comments that are purposeful and contextual clearly explaining the intent rationale or context behind the commented code."
"What should a verification checklist for code comments confirm?", "Minimalist Commenting. Purpose-Driven Comments. Avoid Redundant Comments. Prioritize Public Methods. Explain Purpose of Class Members. Technical and Descriptive Comments. Purposeful and Contextual Comments."
"What is the primary objective of the HTML Global Attribute Generation Ruleset?", "To guide AI agents in appropriately and effectively utilizing HTML global attributes when generating HTML markup emphasizing semantic correctness accessibility maintainability and responsible attribute usage."
"What is the core principle regarding the use of global attributes in HTML?", "Always use global attributes to enhance the *meaning* and *functionality* of HTML elements not solely for styling."
"What is a fundamental consideration when using global attributes?", "Prioritize accessibility-related global attributes (ARIA attributes `role` `tabindex` `lang` `title`)."
"How should you approach the use of global attributes for maintainability and readability?", "Use global attributes judiciously and with clear intent. Overuse or misuse can make HTML verbose."
"What are the potential performance implications of using event handler attributes?", "Be mindful of potential performance implications when using event handler attributes (e.g. `onclick`). Prefer JavaScript event listeners."
"How can you ensure that global attributes are used validly?", "Ensure that global attributes are used validly according to HTML standards and within the correct context."
"When should you use the `id` attribute?", "Use `id` attributes sparingly and primarily for *unique identification within a page*."
"What are the best practices for using `id` attributes?", "Uniqueness: `id` values must be unique. Descriptive: `id` values should be descriptive. Avoid Styling Hooks Primarily. JavaScript Hook (Primary Use)"
"When should you use the `class` attribute?", "Use `class` attributes extensively for applying CSS styles and for semantic or functional grouping."
"What are the best practices for using `class` attributes?", "Descriptive Class Names. Reusability. Multiple Classes. Semantic Grouping (Beyond Styling)"
"When should you use the `style` attribute (inline styles)?", "Avoid `style` attributes for general styling. Reserve for dynamic styles applied by JavaScript or very specific one-off overrides."
"What are the best practices and considerations when using the `style` attribute?", "Maintainability Issues. Specificity Issues. External CSS Preferred"
"When should you use the `title` attribute?", "Use `title` attributes to provide supplementary information or tooltips for elements on mouse hover."
"What are the best practices and considerations when using the `title` attribute?", "Conciseness. Accessibility Consideration. Contextual Help or Clarification. Avoid Redundancy"
"When should you use the `role` attribute (ARIA role)?", "Use `role` attributes to enhance semantic meaning and accessibility primarily for custom UI components or where semantic HTML is insufficient."
"What are the best practices for using the `role` attribute?", "ARIA Landmark Roles. Widget Roles. Follow ARIA Guidelines. Semantic HTML Preference"
"When should you use `aria-*` attributes (ARIA states and properties)?", "Use `aria-*` attributes in conjunction with `role` or on semantic HTML to convey state properties and relationships to assistive technologies."
"What are the best practices for using `aria-*` attributes?", "Dynamic Content and UI. Common ARIA Attributes. JavaScript Dynamic Updates. State & Relationship Conveyance. Careful Implementation & Testing"
"When should you use the `tabindex` attribute?", "Use `tabindex` attribute to control the keyboard focus order or to make normally non-focusable elements keyboard focusable."
"What are the best practices for using the `tabindex` attribute?", "`tabindex=\"0\"` (Make Element Focusable and Add to Natural Tab Order). `tabindex=\"-1\"` (Make Element Focusable but Remove from Tab Order). Avoid Positive `tabindex` Values. Focus Management"
"When should you use the `lang` attribute?", "Always use `lang` attribute on the `<html>` element to declare the primary language. Use on sections or elements with different language."
"What are the best practices for using the `lang` attribute?", "`<html>` Language Declaration (Essential). Language Subsections. Consistent Language Tags"
"When should you use the `dir` attribute (text directionality)?", "Use `dir` attribute primarily for right-to-left (RTL) languages. Set `dir=\"rtl\"`."
"What are the best practices for using the `dir` attribute?", "RTL Language Support (Essential). Content Sections. Logical Properties in CSS"
"When should you use the `rel` attribute on `<link>` and `<a>` elements?", "Use `rel` attribute on `<link>` and `<a>` to define the relationship between the current document and the linked resource."
"What are some best practices for using the `rel` attribute?", "`<link rel=\"stylesheet\">` (Stylesheet Linking - Essential). `<link rel=\"icon\">` (Favicon - Common). `<link rel=\"canonical\">` (SEO). `<a rel=\"nofollow\">` (SEO). `<a rel=\"noopener\">` and `<a rel=\"noreferrer\">` (Security & Privacy). Refer to HTML Specification."
"When should you use the `href` attribute on `<a>` and `<link>` elements?", "Always use `href` attribute on `<a>` and `<link>` to specify the destination URL."
"What are some best practices for using the `href` attribute?", "Valid URLs. Meaningful URLs. Protocol Consideration (HTTPS)"
"When should you use the `target` attribute on `<a>` elements?", "Use `target` attribute on `<a>` to specify where the linked resource should be displayed."
"What are the best practices and considerations for using the `target` attribute?", "`target=\"_blank\"` (New Tab - Use Carefully). `rel=\"noopener noreferrer\"` with `target=\"_blank\"` (Security & Privacy - Essential). Default `_self` (Same Tab - Often Preferred). `base target` (Less Common)"
"When should you use the `value` attribute on form elements?", "Use `value` attribute on form elements to set the initial or current value."
"What are the best practices for using the `value` attribute?", "Initial Input Value. Button Text. `<option>` Value (Crucial for Forms). Dynamic Updates (JavaScript)"
"When is the `name` attribute essential for form controls?", "Always use `name` attribute on form controls that are intended to be submitted as part of a form."
"What are the best practices for using the `name` attribute?", "Server-Side Identification. Meaningful Names. Uniqueness (Within Form)"
"When should you use the `disabled` attribute?", "Use `disabled` attribute to disable form controls or other interactive elements."
"What are the best practices for using the `disabled` attribute?", "Form Validation and Control Flow. Visual Indication (Pair with CSS). JavaScript Enablement/Disablement"
"When should you use inline event handler attributes (e.g., `onclick`)?", "Use event handler content attributes sparingly and with caution. Consider JavaScript event listeners."
"What are the best practices and considerations for using inline event handler attributes?", "Simple Isolated Interactions (Limited Use). Maintainability Issues (Inline JavaScript). Accessibility Concerns (Inline JavaScript). JavaScript Event Listeners (Preferred for Most Cases)"
"What is the primary objective of the HTML Element Generation Ruleset for AI Agents?", "To guide AI agents in generating semantically correct accessible well-structured performant and maintainable HTML markup using non-deprecated elements."
"What is the core principle for selecting HTML elements?", "Always prioritize using semantic HTML5 elements that accurately describe the *meaning* and *purpose* of the content."
"How should you structure content within an HTML document?", "Utilize semantic sectioning elements (`<header>`, `<nav>`, `<main>`, `<article>`, `<section>`, `<aside>`, `<footer>`)."
"How should you use heading elements (`<h1>` - `<h6>`)?", "Employ heading elements to create a clear and logical heading hierarchy."
"When should you use `<p>` elements?", "Use `<p>` elements to wrap blocks of standard text content."
"When should you use list elements (`<ul>`, `<ol>`, `<dl>`)?", "Use semantic list elements appropriately for presenting *lists* of items."
"How should you semantically group media content with captions?", "Use `<figure>` and `<figcaption>` elements."
"How do you create accessible forms?", "Always associate form controls with `<label>` elements. Use ARIA attributes when needed."
"What is the essential attribute for making images accessible?", "Always provide meaningful `alt` text for `<img>` elements using the `alt` attribute."
"How do you create accessible links?", "Write clear and meaningful link text for `<a>` elements."
"How do you create accessible tables?", "Structure tables semantically using `<table>`, `<thead>`, `<tbody>`, `<tfoot>`, `<tr>`, `<th>`, and `<td>`. Use `<caption>`."
"What should you include when embedding `<audio>` and `<video>` elements?", "Always include `controls` attribute. Provide captions/transcripts for accessibility. Consider `<track>`."
"When should you use ARIA attributes, and what is the relationship to semantic HTML?", "Use ARIA to enhance accessibility only when semantic HTML is insufficient. Do not overuse ARIA. Prioritize semantic HTML."
"How do you maintain a logical document outline?", "Maintain a logical and consistent heading level structure (`<h1>` to `<h6>`)."
"Why is consistent HTML indentation important?", "Indent HTML code consistently to reflect nesting structure for readability."
"What should you avoid regarding the depth of the DOM tree?", "Avoid overly deep nesting of HTML elements."
"How should you group related content in HTML?", "Group semantically related HTML elements together using appropriate container elements."
"When should you use HTML comments?", "Use HTML comments to explain complex or non-obvious sections of markup."
"What kind of class names should you use?", "Use descriptive and meaningful CSS class names."
"Why is it important to maintain consistent HTML coding conventions?", "Adopt and maintain consistent HTML coding conventions. Consistency improves readability and maintainability."
"What should you do regularly to ensure HTML quality?", "Regularly validate generated HTML markup using HTML validators."
"How can you minimize the size of the DOM?", "Generate HTML that is as lean and efficient as possible avoiding unnecessary elements and deep nesting."
"How can you improve initial page load time related to images?", "Automatically add `loading=\"lazy\"` attribute to `<img>` elements that are below-the-fold."
"How can you optimize the loading of JavaScript in your HTML?", "Place `<script>` tags strategically. Use `defer` or `async` attributes. Place non-blocking scripts at the end of `<body>`."
"List the Document Structure Elements.", "`<!DOCTYPE html>` `<html>` `<head>` `<title>` `<meta>` `<link>` `<style>` `<base>` `<noscript>` `<script>` `<body>`"
"List the Sectioning Content Elements.", "`<header>` `<nav>` `<main>` `<article>` `<section>` `<aside>` `<footer>`"
"List the Text Content Elements.", "`<h1>`-`<h6>` `<p>` `<br>` `<hr>` `<pre>` `<blockquote>` `<q>`"
"List the Inline Text Semantics Elements.", "`<a>` `<em>` `<strong>` `<small>` `<mark>` `<del>` `<ins>` `<u>` `<s>` `<code>` `<kbd>` `<samp>` `<var>` `<cite>` `<sup>` `<sub>` `<span>`"
"List the Image and Multimedia Elements.", "`<img>` `<picture>` `<audio>` `<video>` `<source>` `<track>` `<svg>` `<canvas>`"
"List the Embedded Content Elements.", "`<iframe>` `<embed>` `<object>` `<param>`"
"List the Scripting Elements.", "`<script>` `<noscript>` `<template>`"
