question,answer
"What is the preferred method for dependency injection in modern Angular (19+) components, services, and injectables, and why?","The preferred method is to use the `inject()` function. Constructor injection should only be used for specific legacy scenarios or framework interoperability needs. `inject()` is preferred because it is more type-safe concise reduces boilerplate and improves code readability compared to traditional constructor injection."
"Generate an Angular service called `ProductService` that uses the `inject()` function to inject the `HttpClient`. The service should have a method `getProducts()` that returns an Observable of `Product[]`. Convert this Observable to a signal for use in a component.","```typescript\nimport { Injectable, inject } from '@angular/core';\nimport { HttpClient } from '@angular/common/http';\nimport { Observable } from 'rxjs';\nimport { toSignal } from '@angular/core/rxjs-interop';\n\ninterface Product {\n  id: number;\n  name: string;\n  price: number;\n}\n\n@Injectable({\n  providedIn: 'root'\n})\nexport class ProductService {\n  private http = inject(HttpClient);\n\n  getProducts(): Observable<Product[]> {\n    return this.http.get<Product[]>('/api/products');\n  }\n     // Convert the observable from to a signal to avoid async pipe in templates\n    productsSignal = toSignal(this.getProducts(), {initialValue: []});\n}\n```"
"Explain the difference between `providedIn: 'root'` and providing a service at the component level. When should each approach be used?","`providedIn: 'root'` creates a single shared instance of the service across the entire application (singleton). Component-level providers create a new instance of the service for each instance of the component and its children. Use `providedIn: 'root'` for services that should be shared globally (for example authentication or logging). Use component-level providers for services that should be scoped to a specific component and its children (for example form state or component-specific data)."
"How do you ensure type safety when using the `inject()` function?","Always use the generic type parameter with `inject()` to specify the type of the injected dependency. For example: `private readonly myService = inject<MyService>(MyService);` or if using an injection token `private readonly myService = inject<MyServiceInterface>(MyServiceToken);`."
"Describe how to implement dynamic component injection in Angular including the role of `ViewContainerRef` and `createComponent()` and the use of an `environmentInjector`.  Give a code example.","Dynamic component injection allows you to load components on demand. You use `ViewContainerRef` to get a reference to a container element in your template where the dynamic component will be inserted.  Then use `createComponent(ComponentClass, { viewContainerRef: ..., injector: ... })` to create an instance of the component and insert it into the view.  The `environmentInjector` ensures the component has access to the correct dependencies.\n\n```typescript\nimport { Component, ViewContainerRef, createComponent, inject, EnvironmentInjector } from '@angular/core';\nimport { DynamicComponent } from './dynamic.component';\n\n@Component({\n  selector: 'app-dynamic-host',\n  template: '<ng-container #container></ng-container>',\n})\nexport class DynamicHostComponent {\n  private viewContainerRef = inject(ViewContainerRef);\n    private environmentInjector = inject(EnvironmentInjector);\n\n  async loadComponent() {\n    this.viewContainerRef.clear(); // Clear any existing components\n    const { DynamicComponent } = await import('./dynamic.component');\n    const componentRef = createComponent(DynamicComponent, {\n      environmentInjector: this.environmentInjector,\n    });\n\n    this.viewContainerRef.insert(componentRef.hostView);\n  }\n}\n```"
"What are the key principles of the Angular Dependency Injection Ruleset?", "The core principles are: \n1.  **`inject()` as Default:** Always prefer `inject()` over constructor injection.\n2.  **Performance-Focused DI:** Design DI configurations with performance in mind (lazy loading dynamic injection).\n3.  **SOLID Principles:** Adhere to SOLID principles for robustness and maintainability."
"Explain the difference between lazy-loading *modules* and dynamic *component* injection. When would you choose one over the other?", "Lazy-loading modules (via the Angular Router) is suitable for feature-level code splitting.  It loads an entire module and its components when a route is activated.  Dynamic component injection is more appropriate for loading individual UI components on-demand *within* a component or feature (for example conditionally displaying a component based on user interaction).  Module lazy loading is for larger feature separation; dynamic component injection is for finer-grained on-demand component instantiation."
"Generate an Angular route configuration that lazy-loads a standalone component called `DashboardComponent` from a file called `dashboard.component.ts`.  Use the `loadComponent` syntax.", "```typescript\nimport { Routes } from '@angular/router';\n\nexport const routes: Routes = [\n  {\n    path: 'dashboard',\n    loadComponent: () => import('./dashboard.component').then(m => m.DashboardComponent)\n  }\n];\n```"
"What is the purpose of an Injection Token and how is it used to promote decoupling in Angular applications?", "Injection Tokens are used to provide interfaces or abstract types as dependencies instead of concrete classes. This promotes decoupling because components and services depend on the *abstraction* (the interface) rather than a specific *implementation*. This makes it easier to change or substitute implementations without modifying the consuming components.  You create an InjectionToken and then use it in providers (`useClass`, `useFactory`, etc.) to map the token to a concrete implementation."
"Provide an example of using an Injection Token to provide an interface called `Logger` with two different implementations: `ConsoleLogger` and `RemoteLogger`. Show how a component would inject the `Logger` interface.", "```typescript\nimport { Injectable, InjectionToken, inject, Component } from '@angular/core';\n\n// Define the interface\nexport interface Logger {\n  log(message: string): void;\n}\n\n// Create the Injection Token\nexport const LOGGER_TOKEN = new InjectionToken<Logger>('Logger');\n\n// Implementation 1: ConsoleLogger\n@Injectable({\n  providedIn: 'root',\n  useFactory: () => new ConsoleLogger(), // Could also use useClass: ConsoleLogger\n  deps: [LOGGER_TOKEN] //Optional deps\n})\nexport class ConsoleLogger implements Logger {\n  log(message: string) {\n    console.log(message);\n  }\n}\n\n// Implementation 2: RemoteLogger (Illustrative - would need actual remote logging logic)\n@Injectable()\nexport class RemoteLogger implements Logger {\n  log(message: string) {\n    // Send log message to a remote server\n    console.log('Sending to remote: ' + message);\n  }\n}\n\n\n// Component that injects the Logger interface\n@Component({\n  selector: 'app-my-component',\n  template: `<button (click)=\\\"logMessage()\\\">Log Message</button>`,\n  providers: [\n     //Choose the provider for the logger token here.\n    { provide: LOGGER_TOKEN, useClass: ConsoleLogger } // Or RemoteLogger\n  ]\n})\nexport class MyComponent {\n private logger = inject(LOGGER_TOKEN);\n\n  logMessage() {\n    this.logger.log('This is a test message!');\n  }\n}\n\n```"
"How does adhering to the Liskov Substitution Principle (LSP) improve the robustness of an Angular application using Dependency Injection?", "LSP states that objects of a superclass should be replaceable with objects of their subclasses without altering the correctness of the program.  In Angular DI this means that if you inject an interface (using an Injection Token) any concrete implementation provided for that token should be interchangeable without breaking the consuming components. This makes the application more flexible less brittle and easier to test because you can swap implementations easily."
"Explain the Single Responsibility Principle (SRP) and how it applies to designing Angular Services.", "SRP states that a class (or service) should have only one reason to change.  In Angular Services this means a service should have a focused well-defined responsibility (for example data access user authentication). Avoid creating 'God object' services that handle too many unrelated tasks.  Focused services are easier to reuse test and maintain."
"How does interface-based programming with Injection Tokens in Angular implicitly support the Interface Segregation Principle (ISP)?", "ISP states that clients should not be forced to depend on methods they do not use.  By using Injection Tokens to provide *interfaces* instead of concrete classes you can create smaller more focused interfaces that represent specific functionalities.  Components then depend only on the interfaces they need promoting modularity and cohesion."
"Create a checklist for verifying that generated Angular code adheres to the advanced Dependency Injection practices.", "[ ] `inject()` Function as Default: Is the `inject()` function used as the primary method for dependency injection (not constructor injection except for justified legacy/interop cases)?\n[ ] Type Safety with `inject()`: Is the generic type parameter consistently used with `inject()` for type safety?\n[ ] Dynamic Component Injection (Where Applicable): Is dynamic component injection considered and implemented for UI features suitable for on-demand loading or modularity?\n[ ] Lazy Loading Modules/Components (Route-Based): Is route-based lazy loading configured for feature modules or standalone components to optimize initial load time?\n[ ] Factory Providers for Complex Logic: Are Factory Providers used where dependency creation requires complex logic runtime configuration or asynchronous operations?\n[ ] Injection Tokens for Interfaces (Decoupling): Are Injection Tokens used to provide interfaces as dependencies promoting decoupling and substitutability?\n[ ] Provider Scope Management (`providedIn: 'root'` vs. Component-Level): Is provider scope ( `providedIn: 'root'` or component-level ) appropriately chosen based on the intended service sharing and lifecycle?\n[ ] SOLID Principles Adherence (LSP SRP ISP): Does the DI design adhere to SOLID principles particularly LSP and SRP ensuring robustness and maintainability?\n[ ] Performance-Conscious DI: Is the DI configuration optimized for performance considering lazy loading dynamic injection and efficient provider strategies?"
"What are the core architectural principles of the Angular Architecture Generation Ruleset?", "The core architectural principles are:\n1. Component-Based Architecture\n2. Standalone Components\n3. Services for business logic\n4. Smart vs Dumb Components\n5. Data Down Actions Up\n6. Lazy Loading"
"Explain the difference between 'Smart' (Container) components and 'Dumb' (Presentational) components in Angular and why this distinction is important.", "Smart components are responsible for data fetching state management and business logic. Dumb components are primarily focused on rendering UI based on inputs with minimal or no internal logic. Smart components orchestrate and provide data to Dumb components. This pattern promotes component reusability testability and separation of concerns. Dumb components are reusable UI building blocks while Smart components manage data flow."
"Describe the 'Data Down Actions Up' pattern in Angular component communication. Why is this pattern preferred over two-way data binding?", "Data Down Actions Up is a unidirectional data flow pattern. Parent components pass data *down* to child components via Inputs. Child components communicate events/actions *up* to parent components via Outputs. This improves predictability simplifies debugging and makes data flow easier to manage. Two-way data binding can make it harder to track changes and reason about the application's state."
"What is the primary mechanism for dependency injection in modern Angular (19+) and why is it preferred over constructor injection?", "The primary mechanism is the `inject()` function. It is preferred over constructor injection because it improves type safety conciseness and adheres to modern Angular patterns. `inject()` provides a cleaner and more type-safe alternative."
"Explain the importance of managing provider scope in Angular (root vs. component-level).", "Provider scope determines the lifecycle and sharing of a dependency. `providedIn: 'root'` creates a single application-wide instance (singleton). Component-level providers create a new instance for each component and its children. Choosing the correct scope ensures dependencies are available where needed and follow appropriate instantiation patterns (singleton vs component-specific)."
"What is the primary mechanism for managing reactive state in Angular 19+ and what are its advantages?", "Angular Signals are the primary mechanism for managing reactive state in Angular 19+. Signals provide a performant efficient and type-safe approach to state management minimizing change detection overhead. The main APIs are `signal()`, `computed()`, `effect()`, `input()`, and `output()`."
"How should application-wide shared state be managed in an Angular application using Signals?", "Application-wide shared state should be managed within Angular Services using Signals. Components should consume and react to signals exposed by services not duplicate state management logic. Services act as central state repositories."
"What are the key benefits of using `OnPush` change detection strategy in Angular components?", "`OnPush` change detection significantly reduces change detection overhead and improves application performance. It limits change detection cycles to only components that have received input changes or triggered events. This minimizes unnecessary computations."
"Explain how to implement deferred loading in Angular using `@defer` blocks. What are the benefits?", "Deferred loading using `@defer` blocks allows you to optimize initial load time by deferring the loading of non-critical UI sections components and resources. You wrap the content you want to defer in an `@defer` block.  This reduces the initial bundle size and improves page load speed. You can specify triggers like `on viewport`, `on interaction`, `on timer`, or `when` (conditional)."
"How can you minimize DOM operations and layout thrashing in Angular components to improve performance?", "Minimize direct DOM manipulations and operations that trigger layout reflows within components lifecycle hooks or effects. Use Angular's rendering pipeline and data binding. If DOM operations are necessary batch them defer them or use techniques to reduce layout recalculations."
"Why is it important to organize an Angular application into modular Feature Modules (or feature folders for standalone components)?", "Modular Feature Modules (or feature folders for standalone components) encapsulate related components services and functionality. This promotes modularity encapsulation and independent feature development and maintenance. It improves code organization reduces dependencies and makes large applications more manageable and scalable."
"What are the benefits of defining clear and well-documented boundaries and APIs for Angular components and services?", "Well-defined APIs and boundaries improve component and service reusability testability and maintainability. Clear interfaces make it easier to understand how different parts of the application interact and reduce the risk of unintended side effects."
"Why is it important to adhere to consistent coding styles and conventions in an Angular application?", "Consistent coding style is crucial for code maintainability and collaboration. It makes code easier to read understand and contribute to by multiple developers. Following established style guides promotes code quality and reduces cognitive load."
"Explain the importance of a comprehensive testing strategy in Angular applications (unit integration E2E tests).", "A comprehensive testing strategy ensures code quality application robustness and prevents regressions. Unit tests test individual components and services. Integration tests verify interactions between components and services. E2E tests validate end-to-end user flows. Automated testing is crucial for long-term maintainability."
"What is the KISS principle and how does it apply to Angular architecture?", "KISS (Keep It Simple Stupid) encourages simplicity in design. In Angular architecture favor the simplest solution that meets requirements and avoid unnecessary complexity or over-engineering. Simpler code is easier to understand maintain debug and test."
"What is the DRY principle and how can it be applied in Angular development?", "DRY (Don't Repeat Yourself) advocates for avoiding code duplication. In Angular extract reusable code patterns UI components services and logic into reusable modules components services mixins or functions. Reusable building blocks reduce development effort promote code sharing and improve code quality."
"Create a checklist for verifying that generated Angular application code and architecture adheres to the expert-level ruleset.", "[ ] Component-Based Architecture: Is the application structured as a hierarchy of reusable independent components?\n[ ] Standalone Components (Default): Are Standalone Components used as the default component type (for new applications and refactoring)?\n[ ] Services for Business Logic & State: Are services used to encapsulate business logic data access and shared state keeping components focused on UI?\n[ ] Smart vs. Dumb Components Pattern: Is there a clear distinction between Smart (Container) and Dumb (Presentational) components?\n[ ] Data Down Actions Up (One-Way Data Flow): Is a unidirectional data flow pattern (\"Data Down Actions Up\") enforced in component communication?\n[ ] Lazy Loading Feature Modules (Route-Based): Is lazy loading configured for Feature Modules (or standalone components as routes) via the Angular Router to optimize initial load?\n[ ] `inject()` for Modern DI (Default): Is the `inject()` function used as the primary DI mechanism (not constructor injection)?\n[ ] Injection Tokens for Decoupling: Are Injection Tokens used to provide interfaces/abstract types for dependencies (promoting decoupling)?\n[ ] Provider Scope Management (Root vs. Component): Is provider scope managed appropriately based on service sharing needs (`providedIn: 'root'` vs. component-level)?\n[ ] Signals for Reactive State Management (Primary): Are Signals used as the primary mechanism for state management ( `signal()` `computed()` `effect()` `input()` `output()` )?\n[ ] Services for Shared State (Signal-Based Services): Is application-wide shared state managed in Angular Services using Signals?\n[ ] Immutable Data Patterns (Where Practical): Are immutable data patterns encouraged especially with OnPush and Signals?\n[ ] OnPush Change Detection (Default): Is `ChangeDetectionStrategy.OnPush` set as the default for standalone components?\n[ ] Deferred Loading (`@defer`) - Strategic Usage: Is deferred loading implemented using `@defer` blocks for non-critical UI sections and modules to optimize initial load?\n[ ] Minimal DOM Operations & Layout Reflows (Performance): Are DOM operations and layout reflows minimized in components lifecycle hooks and effects?\n[ ] Optimized Templates - Simple & Efficient Bindings: Are templates kept lean focused on data binding and free of complex logic or method calls?\n[ ] Modular Feature Modules (or Standalone Features): Is the application organized into modular Feature Modules or feature folders for standalone components?\n[ ] Clear Component & Service Boundaries (Well-Defined APIs): Are component and service boundaries clearly defined with well-documented APIs?\n[ ] Consistent Coding Style (Angular Style Guide Adherence): Is a consistent coding style followed throughout the application adhering to Angular Style Guide conventions?\n[ ] Comprehensive Testing Strategy (Unit Integration E2E): Is a comprehensive testing strategy implemented (Unit Integration E2E tests)?\n[ ] KISS Principle Applied (Simplicity): Is the KISS principle applied to component and service design favoring simplicity and avoiding over-engineering?\n[ ] DRY Principle Applied (Reusability): Is the DRY principle applied to avoid code duplication and promote reusability of code patterns components and services?\n[ ] SOLID Principles Guiding Architecture (Overall Design): Are SOLID principles (especially LSP and SRP) considered as overarching guiding principles for the entire application architecture?"
"What are the core principles for generating Angular component templates using the new control flow syntax?", "The core principles are:\n1. Embrace Angular Control Flow: Always use the control flow syntax.\n2. Template Readability & Conciseness\n3. Performance Considerations Integrated\n4. Semantic HTML within Control Flow."
"When should you use the `@let` block in Angular templates?", "Use `@let` to declare local template variables for values that are used multiple times within a template section or to improve readability by assigning descriptive names to expressions. It is also commonly used with the async pipe."
"How do you use the `@let` block in combination with the `async` pipe to handle Observables in templates?", "You use `@let` to unwrap the resolved value of an Observable.  For example: `@let dataValue = myObservable$ | async;`.  This allows you to access the value directly in the template without manual subscriptions."
"When should you use `@if` blocks in Angular templates, and how do you handle multiple conditional branches?", "Use `@if` for straightforward conditional rendering based on boolean expressions. Use `@else if` and `@else` blocks for mutually exclusive branches and to create exhaustive conditional rendering logic."
"How should the AI Agent automatically handle cases where `@if` conditions are always true or always false?", "The AI Agent should automatically remove `@if` blocks if the checked condition is always true or always false based on static analysis.  It should simplify the template by directly rendering the relevant content and removing the unnecessary conditional block and inform the user of the simplification."
"When should you use `@for` blocks, and what is the crucial performance optimization you *must* always implement with `@for`?", "Use `@for` for rendering lists or collections of data.  You *must* always implement the `trackBy` function to efficiently track item identity and minimize DOM updates during list changes."
"What is the purpose of the `trackBy` function in `@for` loops, and what kind of identifier should it use?", "The `trackBy` function helps Angular track item identity in a list. It should use a *unique and stable identifier* for each item (e.g., an item ID). This allows Angular to reuse DOM elements efficiently and minimize rendering overhead when the list is updated."
"How do you handle asynchronous data (Observables) in templates using the new control flow syntax and best practices?", "Use the `async` pipe in combination with `@let` to unwrap and access the resolved value.  Example: `@let dataValue = myObservable$ | async;`. Avoid manual subscriptions or complex async handling within templates."
"How can you conditionally render template sections based on the state of asynchronous data (e.g., loading, data available, error)?", "Combine `@if` with signals that represent the async data loading state (e.g., `isLoadingSignal`, `dataAvailableSignal`). This provides fine-grained control over conditional rendering based on the asynchronous data lifecycle."
"Why is it important to keep Angular templates focused primarily on data display and structural rendering?", "Keeping templates lean and focused on data presentation improves template maintainability testability and performance. Complex logic belongs in the component class not the template."
"Create a checklist for verifying that generated Angular templates with control flow adhere to the ruleset.", "[ ] Angular Control Flow Syntax: Is Angular control flow syntax (`@let` `@if` `@for`) used exclusively for conditional and iterative rendering (no legacy `*ngIf` `*ngFor` `ng-template`)?\n[ ] `@let` for Local Variables & Async Data: Is `@let` used appropriately for local variable declarations and for unwrapping async data using `async` pipe?\n[ ] `@if` for Conditional Rendering - Clear Conditions: Are `@if` blocks used for clear and straightforward conditional rendering based on boolean expressions?\n[ ] `@for` for Iteration - `trackBy` Implemented: Are `@for` loops used for iterative rendering with `trackBy` function *always* implemented for efficient list updates?\n[ ] Unnecessary `@if` Condition Removal (AI Check): Has the AI agent automatically removed any `@if` blocks with conditions that are always true or always false? (and informed user if so)\n[ ] Clean and Consistent Template Indentation: Is template code properly indented for readability and visual structure?\n[ ] Template Comments (Judicious Use - Complexity Only): Are template comments used sparingly and only to explain genuinely complex or non-obvious control flow logic?\n[ ] Minimal Logic in Templates - Data Display Focus: Are templates kept lean and focused on data display avoiding complex logic or function calls directly in templates?"
"What are the core CSS and SCSS best practices that form the foundation of the Angular SCSS Generation Ruleset?", "The core principles are:\n1.  Semantic Selectors Over Generic and IDs\n2.  Efficient Selectors & Specificity Management\n3.  Responsive Design with Media Queries & Flexible Units\n4.  CSS Variables for Theming & Consistency"
